2015 JCA NAME,Count,E1,E2,E3,E4,W1,W2,W3,W4,W5,W6,W7,W8,W9,W10,M1,JCA ID,JCA Definitions
DIAGNOSIS,4,0,0,1,1,0,0,0,0,1,0,0,1,0,0,0,1.4.2.3,"The ability to identify a medical or dental condition, disease, or injurDiagnostic procedures are complimentary to relevant history, signs and symptoms, and results of physical examination."
Direct,2,0,0,0,0,1,0,0,0,1,0,0,0,0,0,0,5.5,The ability to employ resources to achieve an objective.
Directed Energy (ML),0,0,0,0,0,0,0,0,0,0,0,0,0,0,0,0,7.2.1.8,The ability to minimize the effects of directed energy attacks which have the potential to kill personnel and destroy physical assets.
Directed Energy (MN),0,0,0,0,0,0,0,0,0,0,0,0,0,0,0,0,7.2.2.7,The ability to minimize the effects of directed energy attacks which do not have the potential to kill personnel and destroy physical assets.
Directory Services,1,0,0,0,0,0,0,0,0,0,0,1,0,0,0,0,6.2.3.7,"The ability to provide, operate, and maintain a global directory of users, to include directory synchronization with other lower-level systems and information integrity."
Disability Counseling and Coaching,4,0,0,1,1,0,0,0,0,0,1,0,1,0,0,0,1.4.2.6.1,"The ability to provide severely injured or ill service members and families access to a network of professional counseling, information and resources that provide personal support and assistance from injury to reintegration, separation or medical retirement."
Disability Evaluation,1,0,0,0,1,0,0,0,0,0,0,0,0,0,0,0,1.3.2.3,The ability to provide comprehensive assessment of a Service member's fitness for continued service and recommend a disability disposition or return to duty recommendation.
Disease Management:,5,0,0,1,1,0,0,0,0,1,1,0,1,0,0,0,1.4.2.4.6.1,"The ability to provide an organized effort to achieve desired healthcare outcomes in populations with prevalent, often chronic, diseases or conditions for which healthcare practices may be subject to considerable variation."
Disposal of Installation Assets,0,0,0,0,0,0,0,0,0,0,0,0,0,0,0,0,4.7.1.5,"The ability to provide functional real property installation assets with utilities – energy, water, and wastewater; contract and real property management; pollution prevention; and essential services throughout natural or manmade disasters."
Disseminate Information,4,1,0,0,0,1,0,0,0,1,0,1,0,0,0,0,5.2.1.3,The ability to present the refined information to enable comprehension.
Distill Information,4,0,0,0,0,1,0,0,0,1,0,0,1,0,1,0,5.2.1.2,"The ability to individually and collectively comprehend the implications of the character, nature, or subtleties of information about the environment and situation to aid decision-making."
Distill Information,3,0,1,0,0,1,0,0,0,1,0,0,0,0,0,0,5.2.1.2,The ability to filter and refine the discovery and selection of information.
Distributed Computing,2,0,0,0,1,0,0,0,0,0,0,1,0,0,0,0,6.2.2.2,"The ability to provide a virtual computing capability to an end user or application through federation of distributed, location-independent computing resources."
Doctrine,6,0,1,0,1,1,0,0,1,1,0,0,1,0,0,0,1.2.4,The ability to provide fundamental principles that guide the employment of US military forces in coordinated action toward a common objective and serves to make US policy and strategy effective in the application of US military power.
Document Problem Elements,6,0,0,0,0,1,0,1,1,1,1,1,0,0,0,0,5.3.1.2,The ability to produce a description of the situation based on the analysis of the guidance and synthesized information.
Documents & Media (HBC),0,0,0,0,0,0,0,0,0,0,0,0,0,0,0,0,2.2.4.5,"The ability to obtain information from acquired, seized or open-sourced documents and electronic media."
DODIN Capabilities,1,0,0,0,0,0,0,0,0,0,0,1,0,0,0,0,6.1,"The actions taken to design, build, configure, secure, operate, maintain, and sustain DOD communications systems and networks in a way that creates and preserves data availability, integrity, confidentiality, as well as user/entity authentication and non-repudiation."
Economic Adjustment Activities,0,0,0,0,0,0,0,0,0,0,0,0,0,0,0,0,4.7.1.6,"The ability to assess, preserve, maintain, and repair any built, natural, and cultural installation assets. Includes regular surveys and inspections, and measures to comply with environmental and conservation requirements."
Educating,5,1,1,0,0,1,1,0,0,0,0,0,1,0,0,0,1.2.3,"The ability to convey general bodies of knowledge and develop habits of mind applicable to a broad spectrum of endeavors to foster breadth of view, diverse perspectives, critical analysis, and abstract reasoning."
Electromagnetic Pulse (ML),3,0,0,0,1,0,0,1,0,0,0,0,0,0,1,0,7.2.1.5,The ability to minimize the effects of electromagnetic pulse attacks which have the potential to kill personnel and destroy physical assets.
Electromagnetic Pulse (MN),0,0,0,0,0,0,0,0,0,0,0,0,0,0,0,0,7.2.2.4,The ability to minimize the effects of electromagnetic pulse attacks which do not have the potential to kill personnel and destroy physical assets.
Electromagnetic Spectrum (ENK),0,0,0,0,0,0,0,0,0,0,0,0,0,0,0,0,3.2.2.5,"The ability to execute a specified course of action in or through cyberspace through the employment of a device, computer program, or technique, including any combination of software, firmware, or hardware, designed to create an effect in or through cyberspace."
Electromagnetic Spectrum (MN),0,0,0,0,0,0,0,0,0,0,0,0,0,0,0,0,7.2.2.8,The ability to minimize the effects of electromagnetic spectrum attacks which do not have the potential to kill personnel and destroy physical assets.
Electronic Emissions (SC),0,0,0,0,0,0,0,0,0,0,0,0,0,0,0,0,2.2.1.2,The ability to intercept and derive information from non-communication-related emitter transmissions.
Electro-Optical (IC),0,0,0,0,0,0,0,0,0,0,0,0,0,0,0,0,2.2.2.1,"The ability to obtain a visual presentation of any natural or man-made feature, object, or activity derived from the ultraviolet through far infrared electromagnetic spectrum."
Electro-Optical (MSC),0,0,0,0,0,0,0,0,0,0,0,0,0,0,0,0,2.2.3.1,"The ability to collect information on phenomena that emit, absorb, or reflect electromagnetic energy in the ultraviolet through infrared spectrum."
Emergency Services,5,0,0,1,1,0,0,0,1,0,1,0,1,0,0,0,4.7.2.1,"The ability to conduct demolition and disposal activities resulting in the removal of installation assets from the asset inventory by any means, with consideration of the impact to local communities."
Emergency Services,4,0,0,1,1,0,0,0,0,1,0,0,1,0,0,0,1.4.2.4.2,"The ability to provide the initial evaluation, diagnosis, treatment, and disposition of any patient requiring expeditious medical, surgical, or psychiatric care. Emergency services may be provided in a hospital-based or freestanding emergency department (ED), in an urgent care clinic, in an emergency medical response vehicle, or at a disaster site."
End User Services,2,0,0,0,1,0,0,0,0,0,0,1,0,0,0,0,6.2.2.4,"The ability to provide client computing devices and management of those devices. Provide mobile voice, data and video devices. Management of those devices, to include pagers, cell phones, wireless/cellular enabled Personal Data Assistants (PDAs), or other end user devices used by individuals to access information, applications and services."
Engage Partners,3,0,0,0,1,0,0,1,0,0,0,0,0,1,0,0,8.2.1.1,"The ability to integrate and synchronize interaction with selected domestic and foreign institutions, countries, or populations under available identified and aligned authorities and resources authorities to facilitate development of formal or informal relationships."
Engagement,0,0,0,0,0,0,0,0,0,0,0,0,0,0,0,0,3.2,"The ability to secure areas beneath the surface of the earth (bunkers, basements, tunnels, caves, etc.)."
Engineering,0,0,0,0,0,0,0,0,0,0,0,0,0,0,0,0,4.6,The ability to provide coordinated and synchronized contracted support being executed in a designated operational area in support of the Joint Force.
Enhance Mobility,0,0,0,0,0,0,0,0,0,0,0,0,0,0,0,0,4.6.2.2,"The ability to integrate land use, bills of material and forecasts, and construction requirements that facilitate project execution and developing infrastructure and facilities."
Enhance Partner Capabilities and Capacities,0,0,0,0,0,0,0,0,0,0,0,0,0,0,0,0,8.2.3.2,The ability to assess and facilitate the development of partner capabilities and capacities in a manner that takes into account the partner's ability to sustain them and advances partnership goals and mutual interests.
Enhance Physiological Capability,5,0,0,1,1,0,1,0,0,0,0,0,1,0,0,1,1.4.1.1.5,"The ability to improve DoD expeditionary personnel success within the physiological domain to decrease brain injury (neuroprotection), manipulate metabolic processes (related to water intake, nutrition, and waste production), and enhance the ability to withstand trauma and maintain enhanced performance."
Enhance Psychological Resilience,3,0,0,1,1,0,0,0,0,0,0,0,1,0,0,0,1.4.1.1.8,"The ability to enhance DoD expeditionary forces’ resistance to, and recovery from, the emotional outcomes of combat, adversity, and trauma; prevent psychological dysfunction; and strengthen protective factors to stress and negative events. This includes activities that support the early detection and management of combat and operational stress reactions (COSR) in order to preserve mission effectiveness and warfighting capabilities and mitigate the adverse physical and psychological consequences of exposure to severe stress. In the deployed setting, the MHS will support the Military Departments’ implementation of combat and operational stress control (COSC) policies and programs to enhance readiness, contribute to combat effectiveness, enhance the physical and mental health of deployed military personnel, and prevent or minimize adverse effects associated with combat and operational stress."
Enhance Survivability,0,0,0,0,0,0,0,0,0,0,0,0,0,0,0,0,4.6.2.4,"The ability to locate and neutralize the full range of enemy and friendly explosive hazards that may impede routine operations, decrease mobility or present a threat to force protection. It includes the capability to locate, avoid, and neutralize hazards in concert with mounted or dismounted maneuver (breach) or as part of tactical/operational movement (route clearance)."
Enhance Warfighter Learning  Communications and Decision-making,6,0,1,1,1,1,1,0,0,0,0,0,1,0,0,0,1.4.1.1.4,"The ability to enhance individual and team learning/training with high retention of knowledge/skills, individual and team communication, situational awareness (SA), and decision-making."
Enhance Warfighter Sensory  Cognitive  and Motor Capabilities,4,0,0,1,1,0,0,0,0,0,0,0,1,0,1,0,1.4.1.1.3,"The ability to enhance and sustain sensory capabilities; manage/control sensory inputs; enhance and sustain cognitive performance; and monitor, assess, and use the physical and mental status of individual Warfighters and units to enhance commanders' decision-making.  This capability focuses on physiological/metabolic and neurocognitive processes underlying sensory, cognitive and motor capabilities. It involves enhancing, controlling, or sustaining sensory capabilities. Sustainment aims at maintaining baseline sensory capability in other-than-optimal operational environments involving, for example, laser threats, anti-vision weapons, or conditions resulting in short and long term hearing loss. Enhancements include, but are not limited to, recognition of sensory stimuli beyond unaided levels (i.e., vision and hearing abilities enhanced beyond enemy capabilities but without loss of normal aspects such as visual field, acuity, and depth perception). Improved capabilities are especially needed under austere conditions such as fog, smoke, low light, or excessive sensory inputs (e.g., glare, explosions, engine noise, etc.).  Cognitive capability enhancement includes augmenting perception, comprehension, mental model formulation, and future projection to maximize performance and decision-making. Failure can lead to task saturation, information overload/inadequacy, stress, and errors.  Motor capability enhancement can include sustaining baseline physical capability for extended durations in other-than-optimal operational environments (e.g., when degraded from injury, illness or incapacitation as a result of operational exposures); increasing abilities above baseline levels for speed, endurance, strength, and faster than normal physical conditioning; and providing commanders the ability to assess/utilize/incorporate the real time physical and mental status of s DoD expeditionary personnel in their decision-making processes."
Enhanced Language  Regional EXpertise and Culture (LREC),0,0,0,0,0,0,0,0,0,0,0,0,0,0,0,0,8.2.1.3,"The ability to understand the history, language, cultures, beliefs, social structures, politics, and economics of allies, partners, and foreign population to effectively execute missions across the spectrum of military operations."
En-route Care,6,0,0,1,1,0,0,0,0,1,0,0,1,1,1,0,1.4.1.5.3,"The ability to provide continuation of healthcare for critically injured/ill Warfighters accompanied by trained medical providers while being moved to increased medical care capabilities or to a site for final disposition or RTD (JP 1-02). En-route care, which is a shared capability with casualty management, requires detailed coordination, standardization and synchronization. This includes the capability to direct and manage a PM safety program which allows for evaluation of the quality of care standards and process improvement."
Ensure the Physical and Mental Health of the Redeployed Force,3,0,0,1,1,0,0,0,0,0,0,0,1,0,0,0,1.4.1.2.4,"The ability to evaluate and predict physical and mental health effects on a redeployed Warfighter (routine screening and follow-up of immediate and long-term health threats); communicate effective implementation strategies to decision-makers; and provide effective communication and accountability systems enabling contact between commanders, their injured Warfighters, and families."
Enterprise Application Software,1,0,0,0,0,0,0,0,0,0,0,0,1,0,0,0,6.2.3.8,The ability to provide productivity enhancement software made available to all users.
Enterprise Architecture,3,0,0,0,1,0,0,0,0,0,0,1,0,0,1,0,9.2.5,"The ability to conduct reviews with appropriate rigor to improve and support policy development, decision making, management, and administration of DOD capabilities, programs and activities."
Enterprise Messaging,1,0,0,0,0,0,0,0,0,0,0,1,0,0,0,0,6.2.3.6,"The ability to perform electronic messaging between users and organizational entities across the enterprise, including providing customer support."
Enterprise Services,2,0,0,0,1,0,0,0,0,0,0,1,0,0,0,0,6.2,The ability to provide to all authorized users awareness of and access to all DOD information and DOD-wide information services.
Enterprise-Wide Assessment,0,0,0,0,0,0,0,0,0,0,0,0,0,0,0,0,9.2.3,"The ability to translate, validate and prioritize capability and capacity requirements or gaps and manage risk to support DOD strategy."
Environmental,4,0,0,1,1,0,0,0,0,0,0,0,1,0,1,0,1.4.1.4.3.1,"Occupational and environmental health surveillance in garrison and deployed environments will ensure threat and hazard sampling, detection, identification, quantification, risk assessment, and follow-up documentation are performed."
Establish and Maintain Unity of Effort with Mission Partners,0,0,0,0,0,0,0,0,0,0,0,0,0,0,0,0,5.1.1,"The ability to receive, store, prepare and serve nutritious meals, authorized enhancements, and supplements in a sanitary dining facility at an enduring location or afloat based on Service ration cycle and mix, with the ability to project meals to disbursed populations."
Establish Collaboration Policies,9,1,0,0,0,1,1,0,1,1,0,1,1,1,0,1,5.1.3.1,"The ability to understand, select and synthesize contributing functional competencies to achieve optimized action."
Establish Collaborative Procedures,9,1,0,0,0,1,1,0,1,1,0,1,0,1,1,1,5.1.3.2,"The ability to provide command priorities, intent, guidance, and standards to planning, execution, and assessment."
Establish Collective Meaning (Collaboration),7,0,0,0,0,1,0,1,1,1,1,1,0,1,0,0,5.2.3.2,The ability to form collective perspective of the situation.
Establish Commander's EXpectations,6,0,1,0,1,1,0,0,1,1,0,0,0,0,0,1,5.1.2.5,The ability to determine existing and future functional competencies.
Establish Intent and Guidance,8,0,0,0,0,1,0,1,1,1,1,1,1,1,0,0,5.4.4,"The ability to formulate a concise expression of purpose, methods, acceptable risk, and desired end state."
Establish Lines of Communications,0,0,0,0,0,0,0,0,0,0,0,0,0,0,0,0,4.6.1.3,"The ability to employ engineering capabilities and activities, other than combat engineering, that modify, maintain, or protect the physical environment. Examples include: the construction, repair, maintenance, and operation of infrastructure, facilities, lines of communication and bases; terrain modification and repair; and selected explosive hazard activities."
Establish Measures of Effectiveness,1,0,0,0,1,0,0,0,0,0,0,0,0,0,0,0,5.5.3.2,"The ability to establish criteria used to assess changes in system behavior, capability, or operational environment that are tied to measuring the attainment of an end state, achievement of an objective, or creation of an effect."
Establish Measures of Performance,1,0,0,0,1,0,0,0,0,0,0,0,0,0,0,0,5.5.3.1,The ability to establish criteria or conditions used to measure task accomplishment.
Establish Metrics,1,0,0,0,1,0,0,0,0,0,0,0,0,0,0,0,5.5.3,The ability to establish objective criteria to assess performance and results.
Establish Rule Sets,8,0,0,0,0,1,0,1,1,1,1,1,1,1,0,0,5.4.3,The ability to construct directives that delineate circumstances and limitations for actions.
Establish Selection Criteria,6,0,0,0,0,1,0,1,1,1,1,1,0,0,0,0,5.3.5.1,The ability to define the valuation metrics to compare COAs.
Establish/Adapt Lines of Communication and Relationships to Enable Global / Regional Collaboration of all Medical Partners,6,0,0,1,1,0,0,0,0,1,1,0,1,1,0,0,1.4.1.7.3,"The ability to quickly establish or adapt command structures across the force and within the staff, tailored to the mission, to create the processes that will enable horizontal and vertical collaboration."
Evaluate Courses of Actions,6,0,0,0,0,1,0,0,1,1,1,1,0,1,0,0,5.3.5.2,"The ability to assess the strengths and weaknesses of each proposed COA (e.g., exercises, wargames, modeling and simulation, etc)."
Evaluate Operational Environment,6,0,0,0,0,1,0,1,1,1,1,1,0,0,0,0,5.3.2.1,The ability to assess the circumstances and characteristics of a situation or environment.
Evaluation (AP),5,0,0,0,0,1,0,0,0,1,0,1,0,0,1,1,2.4.2,"The ability to identify, classify and verify information associated with time sensitive objectives enabling further analysis or action."
EXercise Medical Management of Seamless Interoperable Medical Operations,4,0,0,0,1,0,0,0,0,1,0,0,1,1,0,0,1.4.1.7.4,The ability to exercise authority and direction by a properly designated commander over assigned and attached forces in order to seamlessly accomplish its mission.
EXercising,5,1,1,0,0,1,1,0,0,0,0,0,1,0,0,0,1.2.2,"The ability to plan, prepare, execute and assess maneuvers or simulated operations to validate training, conduct mission rehearsal, or evaluate capabilities."
EXperimentation,3,0,0,0,1,1,0,0,0,0,0,0,1,0,0,0,1.2.7,"The ability to conduct an iterative process for developing and assessing concept-based hypotheses to identify and recommend the best value-added solutions for changes in doctrine, organization, training, materiel, leadership and education, personnel, and facilities and policy required to achieve significant advances in future operational capabilities."
EXplosives (ML),3,0,0,0,1,0,0,1,0,0,0,0,0,0,1,0,7.2.1.6,The ability to minimize the effects of explosive attacks which have the potential to kill personnel and destroy physical assets.
EXplosives (MN),0,0,0,0,0,0,0,0,0,0,0,0,0,0,0,0,7.2.2.5,The ability to minimize the effects of explosive attacks which do not have the potential to kill personnel and destroy physical assets.
Facilities Support,3,0,0,0,1,0,0,0,0,1,0,0,0,0,0,1,4.7.1.2,"The ability to provide enduring bases and installations with the assets, programs, and services necessary to support US military forces."
Field Maintenance,0,0,0,0,0,0,0,0,0,0,0,0,0,0,0,0,4.3.2,The ability to change an item such that one or more measurable characteristics is altered
First Responder Care,8,0,1,1,1,0,1,0,0,1,0,0,1,1,1,0,1.4.1.6.1,"The ability to provide initial medical care at, or near, the point of injury by the individual or medical and/or non-medical personnel. This may include preparing the casualty for transportation to the next medical capability, as required."
FiXed Target (EK),0,0,0,0,0,0,0,0,0,0,0,0,0,0,0,0,3.2.1.1,The ability to maneuver to secure within the interdependent network of information technology infrastructures and the data within them.
FiXed Target (ENK),0,0,0,0,0,0,0,0,0,0,0,0,0,0,0,0,3.2.2.1,The ability to kinetically engage targets under water at a depth of 40-200 feet.
Food Service,0,0,0,0,0,0,0,0,0,0,0,0,0,0,0,0,4.4.1,"The ability to prove, test, evaluate, inspect, and rework ammunition or ordnance items as required for retaining their desired capability."
Force Application,0,0,0,0,0,0,0,0,0,0,0,0,0,0,0,0,3,"The ability to present, distribute, or make available intelligence, information and environmental content and products that enable understanding of the operational/physical environment to military and national decision-makers."
Force Configuration,10,0,1,1,1,0,1,1,1,1,1,0,0,1,0,1,1.1.2,"The ability to take doctrine, organization, training, material, leadership and education, personnel, and facilities (DOTMLPF) requirements and translate them into programs and structure to accomplish the missions and functions required by the Secretary of Defense."
FORCE HEALTH PROTECTION,6,0,0,1,1,0,1,1,0,0,1,0,1,0,0,0,1.4.1,"The ability to promote, improve, conserve and restore the mental and physical wellbeing of deployed forces."
Force Management,13,1,1,1,1,1,1,1,1,1,0,0,1,1,1,1,1.1,The ability to integrate new and existing human and technical assets from across the Joint Force and its mission partners to make the right capabilities available at the right time and place to support National security.
Force Preparation,5,1,1,0,0,1,1,0,0,0,0,0,1,0,0,0,1.2,"The ability to develop, enhance, adapt and sustain the total force to effectively support National security."
Force Support,12,0,1,1,1,1,1,1,1,1,0,0,1,1,1,1,1,"The ability to establish, develop, maintain and manage a mission ready Total Force."
Foreign Instrumentation (SC),0,0,0,0,0,0,0,0,0,0,0,0,0,0,0,0,2.2.1.3,The ability to intercept data from foreign equipment and control systems.
Forward Resuscitative Care,7,0,1,1,1,0,1,0,0,0,0,0,1,1,1,0,1.4.1.6.2,"The ability to provide expedient healthcare at the point of injury to salvage life, limb, or eyesight and relieve pain. This care includes stabilizing the patient in preparation for transportation to the next higher medical capability, as required."
Forward Unit Feeding,0,0,0,0,0,0,0,0,0,0,0,0,0,0,0,0,4.4.1.2,The ability to provide services and functions essential to the technical management and support of the joint force.
Foster Organizational Collaboration,0,0,0,0,0,0,0,0,0,0,0,0,0,0,0,0,5.1.3,The ability to assign and refine appropriate decision authorities and accountability between leaders and subordinates.
Gap Crossing,0,0,0,0,0,0,0,0,0,0,0,0,0,0,0,0,4.6.1.1,"The ability to enable the planning, organizing, staffing, controlling, and leading of OCS efforts required to meet the Joint Force Commander's objectives."
General Engineering,0,0,0,0,0,0,0,0,0,0,0,0,0,0,0,0,4.6.1,The ability to oversee and integrate of contractor personnel and associated equipment
Geophysical (MSC),0,0,0,0,0,0,0,0,0,0,0,0,0,0,0,0,2.2.3.3,"The ability to detect phenomena and gather information transmitted through the geophysical area of the earth, oceans, and surrounding atmosphere, including man-made objects."
Geospatial Engineering,0,0,0,0,0,0,0,0,0,0,0,0,0,0,0,0,4.6.3,"The ability to enable both mounted and dismounted movement and maneuver where and when desired without interruption or delay through complex terrain (ranging from littoral to mountainous areas), built up areas (cities, towns, and villages to include subterranean structures), and complex manmade and natural obstacles to achieve the commander’s intent without loss of speed or flexibility."
Global Access Engineering,0,0,0,0,0,0,0,0,0,0,0,0,0,0,0,0,4.6.1.4,"The ability to enable joint forces to overcome breaks or openings in terrain (dry or wet, natural or man-made) by providing a system of temporary and permanent crossing techniques and equipment."
Global Force Management,10,0,1,0,1,1,1,1,1,1,0,0,1,1,0,1,1.1.1,"The ability to align force apportionment, assignment, and allocation methodologies in support of the National Defense Strategy and joint force availability requirements; present comprehensive insights into the global availability and operational readiness of U.S. military forces; globally source joint force requirements; and provide senior decision makers a vehicle to quickly and accurately assess the impact and risk of proposed allocation, assignment and apportionment changes. (From Annex A (Glossary) “Global Force Management Guidance FY 2005”)"
Global Patient Movement,11,0,1,1,1,1,1,1,1,1,0,0,1,1,1,0,1.4.1.5,"The ability to evacuate injured and ill personnel with appropriate enroute carThis includes all activities related to CASEVAC, MEDEVAC, aeromedical evacuation (AE), enroute care, patient movement planning, medical regulating, patient staging facilities, patient movement items, and patient in-transit visibilitAlso included are all activities related to maintaining DODs Global Patient Movement Network."
