2015 JCA NAME,Count,E1,E2,E3,E4,W1,W2,W3,W4,W5,W6,W7,W8,W9,W10,M1,JCA ID,JCA Definitions
Communicate,0,0,0,0,0,0,0,0,0,0,0,0,0,0,0,0,8.1,"The ability to understand, engage, develop and present information to domestic partner audiences to improve understanding; and, to foreign partner audiences to create, strengthen, or preserve conditions favorable for the advancement of United States Government interests, policies, and objectives through the use of coordinated programs, plans, themes, messages, and products integrated with the actions of all instruments of national power."
Communicate Intent and Guidance,3,0,0,0,0,1,0,1,0,1,0,0,0,0,0,0,5.5.1,"The ability to promulgate a concise expression of the operational purpose, assessment of acceptable operational risk, and guidance to achieve the desired end state."
Communicate Medical Plan to Support Commander’s Intent and Guidance,4,0,0,0,1,0,0,0,0,1,0,0,1,1,0,0,1.4.1.8.1,"The ability to share the medical plan, which must address the commander’s intent in a concise expression of the operational purpose and desired end state. The medical plan must adapt to changes in the commander’s intent and must be shared early and often to enable parallel planning and self-synchronized execution of a seamless medical system."
Communication Bridge,1,0,0,0,0,0,0,0,0,0,0,1,0,0,0,0,6.1.1.3.1,The ability to interface two or more common communications media or networks.
Communication Gateway,1,0,0,0,0,0,0,0,0,0,0,1,0,0,0,0,6.1.1.3.2,The ability to interface two or more disparate communications media or networks.
Communications (ENKES),0,0,0,0,0,0,0,0,0,0,0,0,0,0,0,0,3.2.2.5.3,The ability to conduct non-kinetic engagements against an adversary’s use of the range of electromagnetic radiation.
Communications (SC),0,0,0,0,0,0,0,0,0,0,0,0,0,0,0,0,2.2.1.1,The ability to intercept and derive information from voice and data communications.
Communications and Computers,2,0,0,0,0,0,0,0,0,0,0,1,0,1,0,0,6,"The ability to provide a framework for full human and technical connectivity and interoperability that allows all DOD users and mission partners to share the information they need, when they need it, in a form they can understand and act on with confidence, and protects information from those who should not have it."
Community Health Education:,4,0,0,1,1,0,0,0,0,1,0,0,1,0,0,0,1.4.2.2.1.3,The ability to provide any combination of learning experiences provided to DoD beneficiaries with the end goal of attempting to bring about behavioral changes that improve or sustain an optimal state of health. Community health education programs begin with a needs assessment to identify population requirements and to determine whether a particular health education program is warranted and/or will be successful.
Community Support,10,0,1,1,0,1,1,1,0,1,1,0,1,1,0,1,1.3.1.1,"The ability to sustain a military member and family support platform encompassing tuition assistance, children’s education, spouse training and employment, child and youth services, morale welfare and recreation, and other programs that underwrite support to military members and their families."
Compensation,2,1,0,0,0,0,0,0,0,0,0,0,0,0,0,1,1.3.2.2,"The ability to develop, implement and oversee policies that maintain fair and competitive pay, and entitlement systems."
Compile Information,4,0,0,0,0,1,0,0,0,1,0,0,1,0,1,0,5.2.1.1,The ability to define and develop the mechanism and methodologies to ensure mission partners fully leverage shared information and the exchange of ideas.
Compile Information,3,0,1,0,0,1,0,0,0,1,0,0,0,0,0,0,5.2.1.1,"The ability to gather information from available sources (e.g. friendly, adversary, neutral, environmental, sociological)"
Computing Services,2,0,0,0,1,0,0,0,0,0,0,1,0,0,0,0,6.2.2,The ability to process data and provide physical and virtual access to hosted information and data centers across the enterprise based on established data standards.
Concepts,3,0,0,0,1,1,0,0,0,0,0,0,1,0,0,0,1.2.6,an expression of how something might be done.
Contagious (MLB),3,0,0,0,1,0,0,1,0,0,0,0,0,0,1,0,7.2.1.2.1,The ability to minimize the effects of contagious biological attacks which have the potential to kill personnel and destroy physical assets.
Contagious (MNB),3,0,0,0,1,0,0,1,0,0,0,0,0,0,1,0,7.2.2.2.1,The ability to minimize the effects of contagious biological attacks which
Content Delivery,2,0,0,0,1,0,0,0,0,0,0,1,0,0,0,0,6.2.3.4,"The ability to accelerate delivery and improve reliability of enterprise content and services, by optimizing the location and routing of information."
Content Discovery,2,0,0,0,1,0,0,0,0,0,0,1,0,0,0,0,6.2.3.3,"The ability to identify, search for, or locate relevant information."
Contingency Base Services,0,0,0,0,0,0,0,0,0,0,0,0,0,0,0,0,4.4.3,"The ability to produce, inspect, and distribute bulk potable water from storage to point of use."
Contingency Fatality Operations,0,0,0,0,0,0,0,0,0,0,0,0,0,0,0,0,4.4.5.1,The ability to provide personal shower and sink facilities and human waste collection and processing for individuals of both sexes in a field environment.
Contingency Location Feeding,0,0,0,0,0,0,0,0,0,0,0,0,0,0,0,0,4.4.1.1,The ability to compare an instrument with an unverified accuracy to an instrument of known or greater accuracy to detect and correct any discrepancy in the accuracy of the unverified instrument.
Continuing Health Education,5,0,1,1,0,0,1,0,0,1,0,0,1,0,0,0,1.4.3.5.4,"The ability to provide health care providers with specific continuing health education to maintain competence and currency regarding core, new and developing areas of study and practice. Educational forums include live, virtual, and constructive events; modeling and simulation; written publications; online programs; and audio, video, or other electronic media. These forums are developed, reviewed, and delivered by experts in their clinical and operational areas. Continuing Health Education must provide health care providers with a venue to sustain currency in accordance with certification/licensure requirements while maintaining global military medical awareness and understanding."
Contract Development,5,0,0,1,0,0,0,1,0,1,1,0,1,0,0,0,1.4.3.1.1,The ability to provide contract strategies that deliver ?best value balance between vendor performance and deliverable quality and cost through collaboration with medical service delivery leadership. Contract Development includes the ability to plan and execute standardized strategies for addressing key health-related acquisition categories.
Contract Modifications,5,0,0,1,0,0,0,1,0,1,1,0,1,0,0,0,1.4.3.1.2,"The ability to alter specification, delivery, contract period, price, quantity, or other provisions of an existing contract through unilateral action in accordance with a contract provision (change order), or by mutual action of the parties to the contract (contract amendment). It includes administrative changes, notices of termination, field orders, and notices of exercise of a contract option and contract extensions."
Contract Support Integration,8,0,1,1,0,0,1,0,0,1,1,0,0,1,1,1,4.5.1,"The ability to provide for search, recovery, mitigation of chemical, biological, or radiological contamination, identification (tentative or positive), temporary storage/interment, preparation for and evacuation of human remains and personal effects to the US."
Contracting,3,0,0,0,1,0,0,1,0,0,0,0,0,0,1,0,9.4.4.2,"The ability to formally enter programs into the acquisition process, fully funded across the Future Years Defense Program."
Contractor Management,3,0,1,0,0,0,0,0,0,1,1,0,0,0,0,0,4.5.2,"The ability to receive, prepare, positively identify, and ship the remains of persons and personal effects to a receiving funeral home in accordance with options offered to the Person Authorized to Direct Disposition (PADD)."
Core and Specialty Medical Education and Training Programs,4,0,1,1,0,0,1,0,0,0,0,0,1,0,0,0,1.4.3.5.1,"The ability to provide effective core medical education and training programs and specialty medical education and training programs to officers, enlisted and civilian personnel to meet the training and certification requirements for their military specialty code(s) and civilian position(s). Core and Specialty Medical Education and Training Programs require the ability to ensure education and training competencies support contingency operations, combatant commander requirements, and the peacetime medical mission; the ability to provide basic and specialty medical education and training which meet or exceed specialty certification and training requirements while focusing on care delivery during global contingency operations and the ability to evaluate education and training programs using evidence-based design to enhance core competencies."
Core Enterprise Services,2,0,0,0,1,0,0,0,0,0,0,1,0,0,0,0,6.2.3,"The ability to provide awareness of, access to and delivery of information on the DODIN via a small set of CIO mandated services."
Corporate Management and Support,1,0,0,0,0,0,0,0,0,1,0,0,0,0,0,0,9,"The ability to develop a network of host-nation relationships activities, and footprint of facilities and forces through decision-making and diplomatic efforts which enable relevant and flexible forward U.S. military presence for contending with uncertainty and shaping the strategic environment."
Counterintelligence (CI),0,0,0,0,0,0,0,0,0,0,0,0,0,0,0,0,2.2.4.2,"The ability to gather information and conduct activities to identify, exploit, or"
Create and Sustain the Healing Environment,3,0,0,0,0,0,0,1,0,1,0,0,1,0,0,0,1.4.3.8,"The ability to program, design, and build health facilities that promote safety, efficient care delivery, patient empowerment, and promote healing through aesthetic qualities (includes the ability to fully sustain existing health facilities to ensure a consistent level of reliable infrastructure and systems operations)."
Credentialing and Privileging,3,0,0,1,0,0,0,0,0,1,0,0,0,0,0,1,1.4.3.4.2,"(1) Credentialing: The ability to confirm the qualifications of health care providers, including collection, verification, assessment and interpretation of practitioner information and documents, such as appropriate education, training, licensure, experience, and expertise. (2) Privileging: The ability to grant permission and assign responsibility to a health care provider to independently provide specified or delineated health care within the scope of his or her license, certification, or registration. Clinical privileges define the scope and limits of practice for individual providers and are based on the capability of the health care facility and on the licensure, relevant training and experience, current competence, health status, judgment, and peer and department head recommendations regarding the health care provider. Credentialing and privileging require the ability to validate professional licensure, education, and training; archive and report qualifications of health care providers; track required provider data; and communicate permissions to health care providers."
Cultivate Coordination with Partner Organizations,12,0,1,1,1,1,1,1,1,1,1,0,1,1,1,0,5.1.1.2,"The ability to align or synchronize interdependent and disparate entities, including their associated processes and capabilities to achieve unity of effort."
Cultivate Relations with Mission Partners,7,0,0,1,1,0,1,0,0,1,1,0,1,1,0,0,5.1.1.1,The ability to exercise authority and direction by a properly designated commander or decision maker over assigned and attached forces and resources in the accomplishment of the mission.
Cyber Network (SC),0,0,0,0,0,0,0,0,0,0,0,0,0,0,0,0,2.2.1.4,"The ability to access and gather data from automated information systems, networks, and data bases."
Cybersecurity,0,0,0,0,0,0,0,0,0,0,0,0,0,0,0,0,6.1.3,"The ability to provide the measures that protect, defend and restore information and information systems."
Cyberspace (ENK),0,0,0,0,0,0,0,0,0,0,0,0,0,0,0,0,3.2.2.4,"The ability to non-kinetically engage a moving target consisting of a region rather than a single point. This includes circular, linear, and irregular shaped targets."
Cyberspace (MTE),0,0,0,0,0,0,0,0,0,0,0,0,0,0,0,0,3.1.1.7,"The ability to maneuver to engage on the surface of the oceans, seas, bays, estuaries, coastal areas, and the littorals."
Cyberspace (MTI),0,0,0,0,0,0,0,0,0,0,0,0,0,0,0,0,3.1.2.7,The ability to maneuver to insert on the exterior or upper boundary of the sea.
Cyberspace (MTInfl),0,0,0,0,0,0,0,0,0,0,0,0,0,0,0,0,3.1.3.7,The ability to maneuver to influence on the exterior or upper boundary of the sea.
Cyberspace (MTS),0,0,0,0,0,0,0,0,0,0,0,0,0,0,0,0,3.1.4.7,The ability to secure the surface of the sea.
Data Transformation (PE),0,0,0,0,0,0,0,0,0,0,0,0,0,0,0,0,2.3.1,"The ability to select, focus, simplify, tag and transform overtly or covertly collected data into human or machine interpretable form for further analysis or other action."
Decide,5,0,0,0,1,1,0,0,0,1,0,1,0,1,0,0,5.4,The ability to select a course of action informed and influenced by the understanding of the environment or a given situation.
Deep Water (EKFU),0,0,0,0,0,0,0,0,0,0,0,0,0,0,0,0,3.2.1.1.3.4,The ability to kinetically engage targets under water at a depth of 0-10 feet.
Deep Water (EKMU),0,0,0,0,0,0,0,0,0,0,0,0,0,0,0,0,3.2.1.3.5.4,The ability to kinetically engage targets under water at a depth of 0-10 feet.
Deep Water (EKSU),0,0,0,0,0,0,0,0,0,0,0,0,0,0,0,0,3.2.1.2.3.4,The ability to kinetically engage targets under water at a depth of 0-10 feet.
Defeat EXplosive Hazards,0,0,0,0,0,0,0,0,0,0,0,0,0,0,0,0,4.6.2.1,"The ability to apply site- and threat-adaptable plans and designs, advanced construction techniques and materials in order to enhance the prevention or mitigation of hostile actions against materiel resources, facilities and infrastructure."
Defensive Cyber - Internal Defensive Measures,2,0,0,0,1,0,0,0,0,0,0,1,0,0,0,0,6.1.4,"the ability to dynamically reestablish, re-secure, reroute, reconstitute, or isolate degraded or compromised local networks ensuring sufficient cyberspace access for joint forces."
Defensive Cyber (DC) Response Actions,0,0,0,0,0,0,0,0,0,0,0,0,0,0,0,0,3.2.2.4.2,The ability to non-kinetically engage moving targets below the surface of a body of water.
Define and Prioritize Requirements (P&D),1,0,0,0,0,0,0,1,0,0,0,0,0,0,0,0,2.1.1,The ability to translate national through tactical objectives and needs into specific information and operational requirements.
Define Associated Community,7,0,0,0,0,1,0,1,1,1,1,1,0,1,0,0,5.2.3.1,The ability to identify relevant stakeholders.
Define Knowledge Structure,7,1,0,0,0,1,0,1,1,1,0,1,0,1,0,0,5.2.2.3,"The ability to organize information into cogent, actionable context."
Define Structure,8,1,0,1,0,0,1,0,1,1,0,1,0,0,1,1,5.1.2.1,The ability to facilitate professional and personal relationships with military and civilian counterparts.
DEFINE THE HEALTH BENEFIT,13,1,1,1,0,1,1,1,1,1,1,0,1,1,1,1,1.4.2.1,"The ability to identify and plan for specific healthcare needs associated with a population of eligible beneficiaries and continuously measure, monitor, and positively influence health and wellness through evidenced-based preventive and interventional healthcare services."
Deliver and Adjust Influential Content,2,0,0,0,0,0,0,1,0,0,0,0,0,1,0,0,8.1.3.3,"The ability to use selected senders and media to deliver themes, messages, information, and indicators to an adversary or competitor to respond in a manner that is in the interest of U.S. Government goals and objectives plans and, if required, recommend modification to theme, message, senders or medium."
Deliver and Adjust Information,0,0,0,0,0,0,0,0,0,0,0,0,0,0,0,0,8.1.1.3,"The ability to understand the attitudes, opinions grievances, and concerns of partners and use selected senders and media to deliver themes, messages, and objective information in accordance with U.S. Government goals and objectives, and, if required, modify to themes, messages, senders or medium."
Deliver and Adjust Persuasive Content,1,0,0,0,0,0,0,0,0,0,0,0,0,1,0,0,8.1.2.3,"The ability to use selected senders and media to deliver themes, messages, information and indicators in accordance with U.S. government goals objectives, plans and, if required, recommend modification to theme, message, senders or medium."
Deliver Non-Unit-Related Cargo,0,0,0,0,0,0,0,0,0,0,0,0,0,0,0,0,4.1.2.1,"The ability to move forces, equipment and initial sustainment over intertheater distances."
Deliver Non-Unit-Related Personnel,0,0,0,0,0,0,0,0,0,0,0,0,0,0,0,0,4.1.2.2,"The ability to move forces, equipment, and initial sustainment within theater operational areas and over intratheater distances."
Dental Care,3,0,0,1,1,0,0,0,0,0,0,0,0,1,0,0,1.4.1.11.3,The ability to ensure that detainee dental care is conducted in compliance with the provisions of the Geneva Convention and our nation’s stance on human rights.
Deny Movement and Maneuver,0,0,0,0,0,0,0,0,0,0,0,0,0,0,0,0,4.6.2.3,"The ability to employ engineering capabilities and activities that support the maneuver of land combat forces and that require close support to those forces. Combat engineering consists of three types of capabilities and activities: mobility, countermobility, and survivability."
Deployable Scalable and Modular Networks,0,0,0,0,0,0,0,0,0,0,0,0,0,0,0,0,6.1.2.2,"The ability to design, assemble, transport, and establish mission-scaled networks from adaptable components network modules."
Deployment and Distribution,0,0,0,0,0,0,0,0,0,0,0,0,0,0,0,0,4.1,"The ability to disrupt, deny, degrade or destroy adversarial intelligence, surveillance and reconnaissance capabilities."
Depot Maintenance,0,0,0,0,0,0,0,0,0,0,0,0,0,0,0,0,4.3.1,"The ability to assess in real-time global requirements/demands against available resources and capabilities, make recommendations where supplies should be positioned to include WRM and prepositioned assets, and to mitigate risks."
Detainee Emergency Healthcare,3,0,0,1,1,0,0,0,0,0,0,0,0,1,0,0,1.4.1.11.2,The ability to provide emergency medical care and safeguard the health of detained personnel in compliance with the provisions of the Geneva Convention and our nation’s stance on human rights.
Detainee Healthcare,3,0,0,1,1,0,0,0,0,0,0,0,0,1,0,0,1.4.1.11.1,The ability to provide healthcare and safeguard the health of detained personnel in compliance with the provisions of the Geneva Convention and our nation’s stance on human rights.
Detainee Medical Care,3,0,0,1,1,0,0,0,0,0,0,0,0,1,0,0,1.4.1.11,The ability to provide medical care and safeguard the health of detained personnel in compliance with the provisions of the Geneva Convention and our nation’s stance on human rights. There are three sub-categories to this topic; presented as three separate tables in Appendix A.
Determine End State,6,0,0,0,0,1,0,1,1,1,1,1,0,0,0,0,5.3.3.1,The ability to unambiguously define a set of desired final objective conditions.
Determine Opportunities,6,0,0,0,0,1,0,1,1,1,1,1,0,0,0,0,5.3.2.3,The ability to assess existing and potential circumstances leading to success.
Determine Partner Requirements,0,0,0,0,0,0,0,0,0,0,0,0,0,0,0,0,8.2.3.1,"The ability to assess, identify, understand and prioritize the specific type and magnitude of partner capability and capacity needed to address shared goals."
Determine Utility of Foreign Security-Related Capabilities,0,0,0,0,0,0,0,0,0,0,0,0,0,0,0,0,8.2.4.2,The ability to understand and evaluate the actions and incentives necessary to access the capabilities of foreign governments and institutions.
Determine Vulnerabilities,6,0,0,0,0,1,0,1,1,1,1,1,0,0,0,0,5.3.2.2,The ability to assess existing and potential weakness.
Develop and Maintain Facilities,4,0,0,1,1,0,0,0,0,1,0,0,0,0,0,1,4.6.1.2,"The ability to execute and integrate combat, general, and geospatial engineering to meet national and JFC requirements to assure mobility, provide infrastructure to position, project, protect, and sustain the joint force, and enhance visualization of the operational area, across the full spectrum of military operations."
Develop and Maintain Shared Situational Awareness and Understanding,6,0,0,0,1,0,0,0,0,1,0,1,1,1,0,1,1.4.1.8.2,"The ability to access a common operating picture (COP) presenting current and forecast information on adversary and friendly forces, neutral elements, the environment, and geospatial information. This is accomplished through access to both processed and raw data from sensors, analysts and other sources, and through collaborative analysis and assessment of this data. Commanders will ensure that special care and proper procedures be taken in cases involving the transport or transmission of sensitive or classified information. Situational awareness, transformed into knowledge through synthesis, experience and collaboration, will enable situational understanding."
Develop and Manage Defense Health Program (DHP),7,0,0,1,0,0,0,1,0,1,1,0,1,0,1,1,1.4.3.6.1,"The ability to effectively forecast, budget, allocate, execute, analyze, balance, and document funds appropriated by Congress exclusively for the health care needs of our active and retired service members and other eligible beneficiaries and their families in a fiscally responsible manner for helping enhance the efficiency and effectiveness of the overall DoD budget. Effectively managing the DHP requires the means to identify and document financial requirements to support specific and appropriate mission elements of the MHS and meet DoD’s Planning Programming Budget and Execution System (PPBE) objectives as well as Congressional budget justification requirements and includes the ability to project price inflation and apply appropriate commodity inflation rates to properly reflect and justify program growth.. Effective DHP execution requires the ability to allocate and track funding distribution and to coordinate with Government Accountability Office (GAO), the Office of Management and Budget, OUSD (Comptroller), the Defense Finance and Accounting Services (DFAS), and DHP Components and requires mechanisms for analyzing and documenting financial impact of proposed congressional benefit changes and/or language on affected MHS elements. Effectively executing the DHP appropriation includes the ability to review and assess direct and purchased health care data to determine the factors/causes of noticeable changes in health care trends as well as the ability to interact with OUSD (Comptroller), DFAS and DHP Components (Army, Navy, Air Force, JTF CapMed, TMA and the Uniformed Services University of the Health Sciences) to monitor requirements and funding for Overseas Contingency Operations, humanitarian, and other contingency missions to determine whether additional resources may be required to sustain affected MHS elements."
Develop Assumptions,5,0,0,0,0,1,0,1,1,1,0,0,0,0,0,1,5.3.3.2,"The ability to analyze and build suppositions on the current situation or a presupposition on the future course of events, in the absence of positive proof."
Develop Cognitive Programs and Products,1,0,0,0,0,0,0,0,0,0,0,0,0,1,0,0,8.1.2.2,"The ability to develop credible, U.S. Government interagency-synchronized themes, messages, information and indicators with associated metrics, which will persuade foreign audiences to accept and support the strategies, policies, and operations of the U.S. Government and its partners."
Develop Courses of Action,5,0,0,0,0,1,0,1,1,1,1,0,0,0,0,0,5.3.4,The ability to build and refine sequences of activities to achieve a desired outcome or effect.
Develop Influential Programs and Products,2,0,0,0,0,0,0,1,0,0,0,0,0,1,0,0,8.1.3.2,"The ability to develop U.S. Government interagency synchronized themes, messages, information, indicators, with associated metrics, to cause adversary and competitor audiences to react in a manner that is favorable to U.S. interests."
Develop Knowledge and Situational Awareness,4,1,0,0,0,1,0,0,0,1,0,1,0,0,0,0,5.2.2,"The ability to apply context, experience, and intuition to data and information to derive meaning and value."
Develop Objective Information,0,0,0,0,0,0,0,0,0,0,0,0,0,0,0,0,8.1.1.1,"The ability to develop and integrate U.S. Government interagency-synchronized themes and messages themes and messages, and associated metrics, for presentation, to clarify, reinforce, or improve domestic or foreign audience’s understanding of the strategies, policies, and operations of the U.S. Government and its partners."
Develop Objectives,5,0,0,0,0,1,0,0,1,1,1,1,0,0,0,0,5.3.3.3,The ability to clearly define decisive and obtainable goals towards which every operation should be directed in accomplishment of the mission.
Develop Options,5,0,0,0,0,1,0,0,1,1,1,1,0,0,0,0,5.3.4.3,The ability to create a potential or series of potential activities or actions to achieve the assigned objectives.
Develop Partnership Agreements,0,0,0,0,0,0,0,0,0,0,0,0,0,0,0,0,8.2.1.2,"The ability to negotiate and establish partnership agreements based on prioritized relationships, containing measurable objectives, with domestic and foreign institutions, organizations, and governments."
Develop Strategies (P&D),2,0,0,0,1,0,0,1,0,0,0,0,0,0,0,0,2.1.2,"The ability to determine the best approach to collect, process, exploit, analyze, and disseminate data and information to address requirements and predict outcomes."
Develop Strategy,6,0,0,0,0,1,0,1,1,1,1,1,0,0,0,0,5.3.3,The ability to create a framework that synchronizes and integrates the resources available to achieve a desired outcome or effect.
Developmental Engineering,3,0,0,0,1,0,0,1,0,0,0,0,0,0,1,0,9.4.3,The ability to evaluate integrated technologies in a realistic operating environment to assess performance or cost reduction potential of advanced technology.
Developmental Testing,2,0,0,0,0,0,0,0,0,1,0,0,0,0,1,0,9.4.3.2,"The ability to execute a program of record responding to a validated materiel capability need through application of systems engineering, including Integrated System Design and System Capability and Manufacturing Process Demonstration."
